{
  "$schema": "./schemas/catalog.schema.json",
  "schemaVersion": 1,
  "name": "linkease-device-skills",
  "defaultPolicy": {
    "installAll": false
  },
  "presets": [
    {
      "id": "istoreos-on-device",
      "schemaVersion": 1,
      "title": "Use an agent on an iStoreOS device",
      "platform": "istoreos",
      "mode": "on-device",
      "aliases": [
        "iStoreOS on device",
        "在 iStoreOS 上使用",
        "安装到 iStoreOS"
      ],
      "path": "platforms/istoreos/on-device",
      "skillsRoot": "skills",
      "generated": true,
      "generatedFrom": ["common", "linux", "openwrt", "istoreos"]
    },
    {
      "id": "istoreos-remote-control",
      "schemaVersion": 1,
      "title": "Control an iStoreOS device remotely",
      "platform": "istoreos",
      "mode": "remote-control",
      "aliases": [
        "remote control iStoreOS",
        "远程控制 iStoreOS",
        "SSH 控制软路由"
      ],
      "path": "platforms/istoreos/remote-control",
      "skillsRoot": "skills",
      "generated": true,
      "generatedFrom": ["common", "linux", "openwrt", "istoreos", "transport.ssh", "transport.luci-http"]
    },
    {
      "id": "windows-on-device",
      "schemaVersion": 1,
      "title": "Use an agent on a Windows device",
      "platform": "windows",
      "mode": "on-device",
      "aliases": ["Windows on device", "在 Windows 上使用", "本机维护 Windows"],
      "path": "platforms/windows/on-device",
      "skillsRoot": "skills",
      "generated": true,
      "generatedFrom": ["common", "windows"]
    },
    {
      "id": "windows-remote-control",
      "schemaVersion": 1,
      "title": "Control a Windows device remotely",
      "platform": "windows",
      "mode": "remote-control",
      "aliases": ["remote control Windows", "远程控制 Windows", "SSH 控制 Windows"],
      "path": "platforms/windows/remote-control",
      "skillsRoot": "skills",
      "generated": true,
      "generatedFrom": ["common", "windows", "transport.ssh"]
    },
    {
      "id": "macos-on-device",
      "schemaVersion": 1,
      "title": "Use an agent on a macOS device",
      "platform": "macos",
      "mode": "on-device",
      "aliases": ["macOS on device", "在 macOS 上使用", "本机维护 Mac"],
      "path": "platforms/macos/on-device",
      "skillsRoot": "skills",
      "generated": true,
      "generatedFrom": ["common", "macos"]
    },
    {
      "id": "macos-remote-control",
      "schemaVersion": 1,
      "title": "Control a macOS device remotely",
      "platform": "macos",
      "mode": "remote-control",
      "aliases": ["remote control macOS", "远程控制 macOS", "SSH 控制 Mac"],
      "path": "platforms/macos/remote-control",
      "skillsRoot": "skills",
      "generated": true,
      "generatedFrom": ["common", "macos", "transport.ssh"]
    }
  ]
}
